id	identifier	zh_name	en_name	category	cost	short_effect	zh_effect
836	bottle-cap	银色王冠	Bottle Cap	Loot	5000	Trade to Mr. Hyper to maximize one of a Pokémon’s genes.	银色的美丽王冠。 有些人收到它会很高兴。
837	gold-bottle-cap	金色王冠	Gold Bottle Cap	Loot	10000	Trade to Mr. Hyper to maximize all of a Pokémon’s genes.	金色的美丽王冠。 比银色王冠珍贵。 有些人收到它会很高兴。
838	z-ring	Ｚ手环	Z-Ring	Gameplay	0	Allows the player’s Pokémon to use Z-moves.	通过使用训练家的 气力和体力来让宝可梦 释放出Ｚ力量的神奇手环。
839	decidium-z--held	狙射树枭Ｚ	Decidium Z	Z-Crystals	0	Held: Allows Decidueye to upgrade Spirit Shackle into Sinister Arrow Raid.	Ｚ力量的结晶。 会将狙射树枭的缝影 升级成Ｚ招式。
840	incinium-z--held	炽焰咆哮虎Ｚ	Incinium Z	Z-Crystals	0	Held: Allows Incineroar to upgrade Darkest Lariat into Malicious Moonsault.	Ｚ力量的结晶。 会将炽焰咆哮虎的ＤＤ金勾臂 升级成Ｚ招式。
841	primarium-z--held	西狮海壬Ｚ	Primarium Z	Z-Crystals	0	Held: Allows Primarina to upgrade Sparkling Aria into Oceanic Operetta.	Ｚ力量的结晶。 会将西狮海壬的泡影的咏叹调 升级成Ｚ招式。
842	tapunium-z--held	卡璞Ｚ	Tapunium Z	Z-Crystals	0	Held: Allows the Tapus to upgrade Nature’s Madness into Guardian of Alola.	Ｚ力量的结晶。 会将卡璞们的自然之怒 升级成Ｚ招式。
843	marshadium-z--held	玛夏多Ｚ	Marshadium Z	Z-Crystals	0	Held: Allows Marshadow to upgrade Spectral Thief into Soul-Stealing 7 Star Strike.	Ｚ力量的结晶。 会将玛夏多的暗影偷盗 升级成Ｚ招式。
844	aloraichium-z--held	阿罗雷Ｚ	Aloraichium Z	Z-Crystals	0	Held: Allows Alola Raichu to upgrade Thunderbolt into Stoked Sparksurfer.	Ｚ力量的结晶。 会将阿罗拉地区雷丘的 十万伏特升级成Ｚ招式。
845	snorlium-z--held	卡比兽Ｚ	Snorlium Z	Z-Crystals	0	Held: Allows Snorlax to upgrade Giga Impact into Pulverizing Pancake.	Ｚ力量的结晶。 会将卡比兽的终极冲击 升级成Ｚ招式。
846	eevium-z--held	伊布Ｚ	Eevium Z	Z-Crystals	0	Held: Allows Eevee to upgrade Last Resort into Extreme Evoboost.	Ｚ力量的结晶。 会将伊布的珍藏 升级成Ｚ招式。
847	mewnium-z--held	梦幻Ｚ	Mewnium Z	Z-Crystals	0	Held: Allows Mew to upgrade Psychic into Genesis Supernova.	Ｚ力量的结晶。 会将梦幻的精神强念 升级成Ｚ招式。
877	pikashunium-z--held	智皮卡Ｚ	Pikashunium Z	Z-Crystals	0	Held: Allows cap-wearing Pikachu to upgrade Thunderbolt into 10,000,000 Volt Thunderbolt.	Ｚ力量的结晶。 会将戴着帽子的皮卡丘的 十万伏特升级成Ｚ招式。
878	forage-bag	材料袋	Forage Bag	Gameplay	0	Holds ingredients during Mallow’s trial.	将丛林里收集到的材料 装在一起的袋子。 在玛奥的考验中使用。
879	fishing-rod	钓竿	Fishing Rod	Gameplay	0	Allows the player to fish for Pokémon.	水莲队长制作的钓竿。 如果向着岩石阴影那边使用， 就能钓到宝可梦。
880	professors-mask	博士的面罩	Professor’s Mask	Plot advancement	0	Lost by Professor Kukui.	皇家蒙面人的面罩。 好像是职业摔角手 自己用缝纫机缝制的。
881	festival-ticket	圆庆票	Festival Ticket	Gameplay	10	Hosts a mission in Festival Plaza.	可以在圆庆广场 开启游乐项目。
882	sparkling-stone	光辉石	Sparkling Stone	Plot advancement	0	Required to obtain a Z-Ring.	从被认为是阿罗拉守护神的 宝可梦那里得到的石头。 据说其光辉下有着某种秘密。
883	adrenaline-orb	胆怯球	Adrenaline Orb	Held items	4000	Makes wild Pokémon more likely to summon allies. Held: increases the holder’s Speed by one stage when affected by Intimidate.	让宝可梦携带后， 在受到威吓时速度会提高。
884	zygarde-cube	基格尔德多面体	Zygarde Cube	Gameplay	0	Contains collected Zygarde cells/cores. Can teach Zygarde moves.	聚集了宝可梦基格尔德的 核心和细胞的道具。 可以改变基格尔德的样子。
885	ice-stone	冰之石	Ice Stone	Evolution	3000	Evolves an Alola Sandshrew into Alola Sandslash or an Alola Vulpix into Alola Ninetales.	能让某些特定宝可梦 进化的神奇石头。 有着雪花般的花纹。
886	ride-pager	骑行装置	Ride Pager	Unused	0	Allows the player to summon a Ride Pokémon.	通过输入编号，瞬间召唤 与编号对应的坐骑宝可梦的道具。
887	beast-ball	究极球	Beast Ball	Special balls	0	Tries to catch a wild Pokémon. Success rate is 5× for Ultra Beasts and 0.1× for all other Pokémon.	有些与众不同的精灵球。 很难捕捉一般的宝可梦。
888	big-malasada	大马拉萨达	Big Malasada	Status cures	350	Cures major status ailments and confusion.	阿罗拉特产的油炸面包。 能治愈１只宝可梦的 所有异常状态。
889	red-nectar	朱红色花蜜	Red Nectar	Species-specific	300	Changes Oricorio to Baile Style.	在乌拉乌拉花园里获得的花蜜。 可以改变特定宝可梦的样子。
890	yellow-nectar	金黄色花蜜	Yellow Nectar	Species-specific	300	Changes Oricorio to Pom-Pom Style.	在美乐美乐花园里获得的花蜜。 可以改变特定宝可梦的样子。
891	pink-nectar	桃粉色花蜜	Pink Nectar	Species-specific	300	Changes Oricorio to Pa’u Style.	在皇家大道的花园里获得的花蜜。 可以改变特定宝可梦的样子。
892	purple-nectar	兰紫色花蜜	Purple Nectar	Species-specific	300	Changes Oricorio to Sensu Style.	在波尼花园里获得的花蜜。 可以改变特定宝可梦的样子。
893	sun-flute	太阳之笛	Sun Flute	Plot advancement	0	Evolves Nebby into Solgaleo when used at the Altar of the Sunne.	为了对太阳的 传说的宝可梦表达感激之情， 据说会用它来献上美乐。
894	moon-flute	月亮之笛	Moon Flute	Plot advancement	0	Evolves Nebby into Lunala when used at the Altar of the Moone.	为了对月亮的 传说的宝可梦表达感激之情， 据说会用它来献上美乐。
895	enigmatic-card	奇异卡片	Enigmatic Card	Plot advancement	0	Unlocks Looker’s motel room on Route 8.	上面写有“在阿卡拉岛８号道路的 汽车旅馆客房里等”的谜之卡片。
896	terrain-extender	大地膜	Terrain Extender	Held items	4000	Held: Extends the holder’s Terrain effects to 8 turns.	当携带它的宝可梦 利用招式或特性展开场地时， 场地的持续时间会比平时更长。
897	protective-pads	部位护具	Protective Pads	Held items	4000	Held: Prevents side effects of contact moves used on the holder.	不会受到触碰攻击对手时 本应受到的效果。
898	electric-seed	电气种子	Electric Seed	Held items	4000	Held: Consumed on Electric Terrain and raises the holder’s Defense by one stage.	让宝可梦携带后， 在电气场地上使用， 防御就会提高。
899	psychic-seed	精神种子	Psychic Seed	Held items	4000	Held: Consumed on Psychic Terrain and raises the holder’s Special Defense by one stage.	让宝可梦携带后， 在精神场地上使用， 特防就会提高。
900	misty-seed	薄雾种子	Misty Seed	Held items	4000	Held: Consumed on Misty Terrain and raises the holder’s Special Defense by one stage.	让宝可梦携带后， 在薄雾场地上使用， 特防就会提高。
901	grassy-seed	青草种子	Grassy Seed	Held items	4000	Held: Consumed on Grassy Terrain and raises the holder’s Defense by one stage.	让宝可梦携带后， 在青草场地上使用， 防御就会提高。
902	fighting-memory	战斗存储碟	Fighting Memory	Memories	1000	Held: Changes Silvally to its Fighting form. Changes Multi-Attack’s type to Fighting.	装有格斗属性数据的存储碟。 特定宝可梦携带后， 属性就会发生变化。
903	flying-memory	飞翔存储碟	Flying Memory	Memories	1000	Held: Changes Silvally to its Flying form. Changes Multi-Attack’s type to Flying.	装有飞行属性数据的存储碟。 特定宝可梦携带后， 属性就会发生变化。
904	poison-memory	毒存储碟	Poison Memory	Memories	1000	Held: Changes Silvally to its Poison form. Changes Multi-Attack’s type to Poison.	装有毒属性数据的存储碟。 特定宝可梦携带后， 属性就会发生变化。
905	ground-memory	大地存储碟	Ground Memory	Memories	1000	Held: Changes Silvally to its Ground form. Changes Multi-Attack’s type to Ground.	装有地面属性数据的存储碟。 特定宝可梦携带后， 属性就会发生变化。
906	rock-memory	岩石存储碟	Rock Memory	Memories	1000	Held: Changes Silvally to its Rock form. Changes Multi-Attack’s type to Rock.	装有岩石属性数据的存储碟。 特定宝可梦携带后， 属性就会发生变化。
907	bug-memory	虫子存储碟	Bug Memory	Memories	1000	Held: Changes Silvally to its Bug form. Changes Multi-Attack’s type to Bug.	装有虫属性数据的存储碟。 特定宝可梦携带后， 属性就会发生变化。
908	ghost-memory	幽灵存储碟	Ghost Memory	Memories	1000	Held: Changes Silvally to its Ghost form. Changes Multi-Attack’s type to Ghost.	装有幽灵属性数据的存储碟。 特定宝可梦携带后， 属性就会发生变化。
909	steel-memory	钢铁存储碟	Steel Memory	Memories	1000	Held: Changes Silvally to its Steel form. Changes Multi-Attack’s type to Steel.	装有钢属性数据的存储碟。 特定宝可梦携带后， 属性就会发生变化。
910	fire-memory	火焰存储碟	Fire Memory	Memories	1000	Held: Changes Silvally to its Fire form. Changes Multi-Attack’s type to Fire.	装有火属性数据的存储碟。 特定宝可梦携带后， 属性就会发生变化。
911	water-memory	清水存储碟	Water Memory	Memories	1000	Held: Changes Silvally to its Water form. Changes Multi-Attack’s type to Water.	装有水属性数据的存储碟。 特定宝可梦携带后， 属性就会发生变化。
912	grass-memory	青草存储碟	Grass Memory	Memories	1000	Held: Changes Silvally to its Grass form. Changes Multi-Attack’s type to Grass.	装有草属性数据的存储碟。 特定宝可梦携带后， 属性就会发生变化。
913	electric-memory	电子存储碟	Electric Memory	Memories	1000	Held: Changes Silvally to its Electric form. Changes Multi-Attack’s type to Electric.	装有电属性数据的存储碟。 特定宝可梦携带后， 属性就会发生变化。
914	psychic-memory	精神存储碟	Psychic Memory	Memories	1000	Held: Changes Silvally to its Psychic form. Changes Multi-Attack’s type to Psychic.	装有超能力属性数据的存储碟。 特定宝可梦携带后， 属性就会发生变化。
915	ice-memory	冰雪存储碟	Ice Memory	Memories	1000	Held: Changes Silvally to its Ice form. Changes Multi-Attack’s type to Ice.	装有冰属性数据的存储碟。 特定宝可梦携带后， 属性就会发生变化。
916	dragon-memory	龙存储碟	Dragon Memory	Memories	1000	Held: Changes Silvally to its Dragon form. Changes Multi-Attack’s type to Dragon.	装有龙属性数据的存储碟。 特定宝可梦携带后， 属性就会发生变化。
917	dark-memory	黑暗存储碟	Dark Memory	Memories	1000	Held: Changes Silvally to its Dark form. Changes Multi-Attack’s type to Dark.	装有恶属性数据的存储碟。 特定宝可梦携带后， 属性就会发生变化。
918	fairy-memory	妖精存储碟	Fairy Memory	Memories	1000	Held: Changes Silvally to its Fairy form. Changes Multi-Attack’s type to Fairy.	装有妖精属性数据的存储碟。 特定宝可梦携带后， 属性就会发生变化。
919	bike--green	自行车	Bike	Unused	0	XXX new effect for bike--green	能比跑步鞋跑得还快的 折叠式自行车。
920	storage-key--galactic-warehouse	仓库钥匙	Storage Key	Unused	0	XXX new effect for storage-key--galactic-warehouse	用于进入银河队在帷幕市市郊的 可疑仓库的钥匙。
921	basement-key--goldenrod	地下钥匙	Basement Key	Unused	0	XXX new effect for basement-key--goldenrod	用来打开满金地道 大门的钥匙。
922	xtransceiver--red	即时通讯器	Xtransceiver	Unused	0	XXX new effect for xtranceiver--red	带摄像头功能， 最多能让４人进行通话的 最新型对讲机。
923	xtransceiver--yellow	即时通讯器	Xtransceiver	Unused	0	XXX new effect for xtranceiver--yellow	带摄像头功能， 最多能让４人进行通话的 最新型对讲机。
924	dna-splicers--merge	基因之楔	DNA Splicers	Unused	0	XXX new effect for dna-splicers--merge	据说是能让原本为一体的 酋雷姆和某宝可梦 合体的一对楔子。
925	dna-splicers--split	基因之楔	DNA Splicers	Unused	0	XXX new effect for dna-splicers--split	能让合体后的 酋雷姆和某宝可梦 分离成原状的一对楔子。
926	dropped-item--red	遗忘物	Dropped Item	Unused	0	XXX new effect for dropped-item--red	在雷文市的游乐园里 捡到的即时通讯器。 失主好像是个男孩子。
927	dropped-item--yellow	遗忘物	Dropped Item	Unused	0	XXX new effect for dropped-item--yellow	在雷文市的游乐园里 捡到的即时通讯器。 失主好像是个女孩子。
928	holo-caster--green	全息影像通讯器	Holo Caster	Unused	0	XXX new effect for holo-caster--green	可以随时查看接收到的 全息影像数据的装置。
929	bike--yellow	自行车	Bike	Unused	0	XXX new effect for bike--yellow	能比跑步鞋跑得还快的 折叠式自行车。
930	holo-caster--red	全息影像通讯器	Holo Caster	Unused	0	XXX new effect for holo-caster--red	可以随时查看接收到的 全息影像数据的装置。
931	basement-key--new-mauville	地下钥匙	Basement Key	Unused	0	XXX new effect for basement-key--new-mauville	进入紫堇地下的新紫堇时， 所使用的钥匙。
932	storage-key--sea-mauville	仓库钥匙	Storage Key	Unused	0	XXX new effect for storage-key--sea-mauville	进入海紫堇的仓库时 所需的钥匙。
933	ss-ticket--hoenn	船票	S.S. Ticket	Unused	0	XXX new effect for ss-ticket--hoenn	乘坐渡船时需要用到。
934	contest-costume--dress	演出礼裙	Contest Costume	Unused	0	XXX new effect for contest-costume--dress	在华丽现场大赛上演出时穿的 非常可爱的礼裙。
935	meteorite--2	陨石	Meteorite	Unused	0	XXX new effect for meteorite--2	在烟囱山上获得的陨石。 隐约散发着光辉。
936	meteorite--3	陨石	Meteorite	Unused	0	XXX new effect for meteorite--3	在烟囱山上获得的陨石。 持续散发着微光。 摸上去隐约有点暖暖的。
937	meteorite--4	陨石	Meteorite	Unused	0	XXX new effect for meteorite--4	在烟囱山上获得的陨石。 上面浮现着某些花纹， 并散发着七色光芒。
938	normalium-z--bag	一般Ｚ	Normalium Z	Unused	0	XXX new effect for normalium-z--bag	可用它来制造用于对战 并能将一般属性招式升级成 Ｚ招式的Ｚ力量结晶。
939	firium-z--bag	火Ｚ	Firium Z	Unused	0	XXX new effect for firium-z--bag	可用它来制造用于对战 并能将火属性招式升级成 Ｚ招式的Ｚ力量结晶。
940	waterium-z--bag	水Ｚ	Waterium Z	Unused	0	XXX new effect for waterium-z--bag	可用它来制造用于对战 并能将水属性招式升级成 Ｚ招式的Ｚ力量结晶。
941	electrium-z--bag	电Ｚ	Electrium Z	Unused	0	XXX new effect for electrium-z--bag	可用它来制造用于对战 并能将电属性招式升级成 Ｚ招式的Ｚ力量结晶。
942	grassium-z--bag	草Ｚ	Grassium Z	Unused	0	XXX new effect for grassium-z--bag	可用它来制造用于对战 并能将草属性招式升级成 Ｚ招式的Ｚ力量结晶。
943	icium-z--bag	冰Ｚ	Icium Z	Unused	0	XXX new effect for icium-z--bag	可用它来制造用于对战 并能将冰属性招式升级成 Ｚ招式的Ｚ力量结晶。
944	fightinium-z--bag	格斗Ｚ	Fightinium Z	Unused	0	XXX new effect for fightinium-z--bag	可用它来制造用于对战 并能将格斗属性招式升级成 Ｚ招式的Ｚ力量结晶。
945	poisonium-z--bag	毒Ｚ	Poisonium Z	Unused	0	XXX new effect for poisonium-z--bag	可用它来制造用于对战 并能将毒属性招式升级成 Ｚ招式的Ｚ力量结晶。
946	groundium-z--bag	地面Ｚ	Groundium Z	Unused	0	XXX new effect for groundium-z--bag	可用它来制造用于对战 并能将地面属性招式升级成 Ｚ招式的Ｚ力量结晶。
947	flyinium-z--bag	飞行Ｚ	Flyinium Z	Unused	0	XXX new effect for flyinium-z--bag	可用它来制造用于对战 并能将飞行属性招式升级成 Ｚ招式的Ｚ力量结晶。
948	psychium-z--bag	超能力Ｚ	Psychium Z	Unused	0	XXX new effect for psychium-z--bag	可用它来制造用于对战 并能将超能力属性招式升级成 Ｚ招式的Ｚ力量结晶。
949	buginium-z--bag	虫Ｚ	Buginium Z	Unused	0	XXX new effect for buginium-z--bag	可用它来制造用于对战 并能将虫属性招式升级成 Ｚ招式的Ｚ力量结晶。
950	rockium-z--bag	岩石Ｚ	Rockium Z	Unused	0	XXX new effect for rockium-z--bag	可用它来制造用于对战 并能将岩石属性招式升级成 Ｚ招式的Ｚ力量结晶。
951	ghostium-z--bag	幽灵Ｚ	Ghostium Z	Unused	0	XXX new effect for ghostium-z--bag	可用它来制造用于对战 并能将幽灵属性招式升级成 Ｚ招式的Ｚ力量结晶。
952	dragonium-z--bag	龙Ｚ	Dragonium Z	Unused	0	XXX new effect for dragonium-z--bag	可用它来制造用于对战 并能将龙属性招式升级成 Ｚ招式的Ｚ力量结晶。
953	darkinium-z--bag	恶Ｚ	Darkinium Z	Unused	0	XXX new effect for darkinium-z--bag	可用它来制造用于对战 并能将恶属性招式升级成 Ｚ招式的Ｚ力量结晶。
954	steelium-z--bag	钢Ｚ	Steelium Z	Unused	0	XXX new effect for steelium-z--bag	可用它来制造用于对战 并能将钢属性招式升级成 Ｚ招式的Ｚ力量结晶。
955	fairium-z--bag	妖精Ｚ	Fairium Z	Unused	0	XXX new effect for fairium-z--bag	可用它来制造用于对战 并能将妖精属性招式升级成 Ｚ招式的Ｚ力量结晶。
956	pikanium-z--bag	皮卡丘Ｚ	Pikanium Z	Unused	0	XXX new effect for pikanium-z--bag	可用它来制造用于对战 并能将皮卡丘的伏特攻击 升级成特殊Ｚ招式的Ｚ力量结晶。
957	decidium-z--bag	狙射树枭Ｚ	Decidium Z	Unused	0	XXX new effect for decidium-z--bag	可用它来制造用于对战 并能将狙射树枭的缝影 升级成特殊Ｚ招式的Ｚ力量结晶。
958	incinium-z--bag	炽焰咆哮虎Ｚ	Incinium Z	Unused	0	XXX new effect for incinium-z--bag	可用它来制造用于对战 并能将炽焰咆哮虎的ＤＤ金勾臂 升级成特殊Ｚ招式的Ｚ力量结晶。
959	primarium-z--bag	西狮海壬Ｚ	Primarium Z	Unused	0	XXX new effect for primarium-z--bag	可用它来制造用于对战 并能将西狮海壬的泡影的咏叹调 升级成特殊Ｚ招式的Ｚ力量结晶。
960	tapunium-z--bag	卡璞Ｚ	Tapunium Z	Unused	0	XXX new effect for tapunium-z--bag	可用它来制造用于对战 并能将卡璞们的自然之怒 升级成特殊Ｚ招式的Ｚ力量结晶。
961	marshadium-z--bag	玛夏多Ｚ	Marshadium Z	Unused	0	XXX new effect for marshadium-z--bag	可用它来制造用于对战 并能将玛夏多的暗影偷盗 升级成特殊Ｚ招式的Ｚ力量结晶。
962	aloraichium-z--bag	阿罗雷Ｚ	Aloraichium Z	Unused	0	XXX new effect for aloraichium-z--bag	可用它来制造用于对战 并能将阿罗拉地区雷丘的十万伏特 升级成特殊Ｚ招式的Ｚ力量结晶。
963	snorlium-z--bag	卡比兽Ｚ	Snorlium Z	Unused	0	XXX new effect for snorlium-z--bag	可用它来制造用于对战 并能将卡比兽的终极冲击 升级成特殊Ｚ招式的Ｚ力量结晶。
964	eevium-z--bag	伊布Ｚ	Eevium Z	Unused	0	XXX new effect for eevium-z--bag	可用它来制造用于对战 并能将伊布的珍藏 升级成特殊Ｚ招式的Ｚ力量结晶。
965	mewnium-z--bag	梦幻Ｚ	Mewnium Z	Unused	0	XXX new effect for mewnium-z--bag	可用它来制造用于对战 并能将梦幻的精神强念 升级成特殊Ｚ招式的Ｚ力量结晶。
966	pikashunium-z--bag	智皮卡Ｚ	Pikashunium Z	Unused	0	XXX new effect for pikashunium-z--bag	可用它来制造用于对战 并能将戴着帽子的皮卡丘的十万伏特 升级成特殊Ｚ招式的Ｚ力量结晶。
967	solganium-z--held	索尔迦雷欧Ｚ	Solganium Z	Unused	0	XXX new effect for solganium-z--held	Ｚ力量的结晶。 会将索尔迦雷欧的流星闪冲 升级成Ｚ招式。
968	lunalium-z--held	露奈雅拉Ｚ	Lunalium Z	Unused	0	XXX new effect for lunalium-z--held	Ｚ力量的结晶。 会将露奈雅拉的暗影之光 升级成Ｚ招式。
969	ultranecrozium-z--held	究极奈克洛Ｚ	Ultranecrozium Z	Unused	0	XXX new effect for ultranecrozium-z--held	Ｚ力量的结晶。 会将奈克洛兹玛的光子喷涌 升级成Ｚ招式。
970	mimikium-z--held	谜拟ＱＺ	Mimikium Z	Unused	0	XXX new effect for mimikium-z--held	Ｚ力量的结晶。 会将谜拟Ｑ的嬉闹 升级成Ｚ招式。
971	lycanium-z--held	鬃岩狼人Ｚ	Lycanium Z	Unused	0	XXX new effect for lycanium-z--held	Ｚ力量的结晶。 会将鬃岩狼人的尖石攻击 升级成Ｚ招式。
972	kommonium-z--held	杖尾鳞甲龙Ｚ	Kommonium Z	Unused	0	XXX new effect for kommonium-z--held	Ｚ力量的结晶。 会将杖尾鳞甲龙的鳞片噪音 升级成Ｚ招式。
973	solganium-z--bag	索尔迦雷欧Ｚ	Solganium Z	Unused	0	XXX new effect for solganium-z--bag	可用它来制造用于对战 并能将索尔迦雷欧的流星闪冲 升级成Ｚ招式的Ｚ力量结晶。
974	lunalium-z--bag	露奈雅拉Ｚ	Lunalium Z	Unused	0	XXX new effect for lunalium-z--bag	可用它来制造用于对战 并能将露奈雅拉的暗影之光 升级成Ｚ招式的Ｚ力量结晶。
975	ultranecrozium-z--bag	究极奈克洛Ｚ	Ultranecrozium Z	Unused	0	XXX new effect for ultranecrozium-z--bag	能让和索尔迦雷欧或 露奈雅拉合体的奈克洛兹玛 变成崭新样子的结晶。
976	mimikium-z--bag	谜拟ＱＺ	Mimikium Z	Unused	0	XXX new effect for mimikium-z--bag	可用它来制造用于对战 并能将谜拟Ｑ的嬉闹 升级成Ｚ招式的Ｚ力量结晶。
977	lycanium-z--bag	鬃岩狼人Ｚ	Lycanium Z	Unused	0	XXX new effect for lycanium-z--bag	可用它来制造用于对战 并能将鬃岩狼人的尖石攻击 升级成Ｚ招式的Ｚ力量结晶。
978	kommonium-z--bag	杖尾鳞甲龙Ｚ	Kommonium Z	Unused	0	XXX new effect for kommonium-z--bag	可用它来制造用于对战 并能将杖尾鳞甲龙的鳞片噪音 升级成Ｚ招式的Ｚ力量结晶。
979	z-power-ring	Ｚ强力手环	Z-Power Ring	Unused	0	XXX new effect for z-power-ring	通过使用训练家的 气力和体力来让宝可梦 释放出Ｚ力量的神奇手环。
980	pink-petal	粉红花瓣	Pink Petal	Unused	0	XXX new effect for pink-petal	在茉莉的考验中， 能从茉莉那里得到的干花花瓣。 目标是集齐７种。
981	orange-petal	橙色花瓣	Orange Petal	Unused	0	XXX new effect for orange-petal	在茉莉的考验中， 能从伊利马那里得到的干花花瓣。 目标是集齐７种。
982	blue-petal	蓝色花瓣	Blue Petal	Unused	0	XXX new effect for blue-petal	在茉莉的考验中， 能从水莲那里得到的干花花瓣。 目标是集齐７种。
983	red-petal	红色花瓣	Red Petal	Unused	0	XXX new effect for red-petal	在茉莉的考验中， 能从卡奇那里得到的干花花瓣。 目标是集齐７种。
984	green-petal	绿色花瓣	Green Petal	Unused	0	XXX new effect for green-petal	在茉莉的考验中， 能从玛奥那里得到的干花花瓣。 目标是集齐７种。
985	yellow-petal	黄色花瓣	Yellow Petal	Unused	0	XXX new effect for yellow-petal	在茉莉的考验中， 能从马玛内那里得到的干花花瓣。 目标是集齐７种。
986	purple-petal	紫色花瓣	Purple Petal	Unused	0	XXX new effect for purple-petal	在茉莉的考验中， 能从默丹那里得到的干花花瓣。 目标是集齐７种。
987	rainbow-flower	虹色之花	Rainbow Flower	Unused	0	XXX new effect for rainbow-flower	将得自队长们那里的花瓣 化零为整后形成的东西。 是成长得到认可的证明。
988	surge-badge	桔色徽章	Surge Badge	Unused	0	XXX new effect for surge-badge	能从关都之道馆那里得到的徽章赠品。 好像仿照了某个地区的道馆徽章。
989	n-solarizer--merge	奈克洛索尔合体器	N-Solarizer	Unused	0	XXX new effect for n-solarizer--merge	用来让需求光的奈克洛兹玛和 索尔迦雷欧合体的机器。
990	n-lunarizer--merge	奈克洛露奈合体器	N-Lunarizer	Unused	0	XXX new effect for n-lunarizer--merge	用来让需求光的奈克洛兹玛和 露奈雅拉合体的机器。
991	n-solarizer--split	奈克洛索尔合体器	N-Solarizer	Unused	0	XXX new effect for n-solarizer--split	用来让曾需求过光的奈克洛兹玛和 索尔迦雷欧分离的机器。
992	n-lunarizer--split	奈克洛露奈合体器	N-Lunarizer	Unused	0	XXX new effect for n-lunarizer--split	用来让曾需求过光的奈克洛兹玛和 露奈雅拉分离的机器。
993	ilimas-normalium-z	伊利马一般Ｚ	Ilima Normalium Z	Unused	0	XXX new effect for ilimas-normalium-z	伊利马交给你保管的一般Ｚ。 受人嘱托要把它放到 葱郁洞窟深处的台座上。
994	left-poke-ball	留下的精灵球	Left Poké Ball	Unused	0	XXX new effect for left-poke-ball	该精灵球里面装的是没有了 训练家的宝可梦。那位训练家 好像是出生自乌拉乌拉岛。
995	roto-hatch	孵蛋碰碰	Roto Hatch	Unused	0	XXX new effect for roto-hatch	洛托姆之力的一种。 使用后，蛋就会变得 非常容易孵化。
996	roto-bargain	优惠碰碰	Roto Bargain	Unused	0	XXX new effect for roto-bargain	洛托姆之力的一种。 使用后，友好商店的 商品就会变成半价。
997	roto-prize-money	零花钱碰碰	Roto Prize Money	Unused	0	XXX new effect for roto-prize-money	洛托姆之力的一种。 对战后能得到的 零花钱会变成３倍。
